{
  "$schema": "../compute.schema.json",
  "id": "supermicro-storage-superserver",
  "pillar": "compute",
  "vendor": "Supermicro",
  "driverVersion": "1.0.0",
  "description": "Supermicro 2U Storage SuperServer SSG-221P-NECTR24R",
  "models": [
    {
      "modelName": "SuperServer SSG-221P-NECTR24R",
      "formFactor": "2U",
      "cpuSockets": 2,
      "supportedCpuArchitectures": [
        "Intel Xeon 4th Gen",
        "Intel Xeon 5th Gen (LGA-4677)"
      ],
      "maxMemoryGb": 8192,
      "memorySlots": 32,
      "memoryType": "DDR5",
      "memorySpeedsMtps": [
        4800,
        5600
      ],
      "maxDimmSizeGb": 256,
      "driveBays": {
        "formFactor": "2.5_SFF",
        "maxSlots": 24,
        "supportedInterfaces": [
          "NVMe",
          "SAS",
          "SATA"
        ]
      },
      "pcieSlots": 6,
      "pcieLanesTotal": 96,
      "pcieSlotDetails": [
        {
          "count": 4,
          "generation": 5,
          "lanes": 16,
          "slotFormFactor": "FHHL"
        },
        {
          "count": 2,
          "generation": 5,
          "lanes": 8,
          "slotFormFactor": "LP"
        }
      ],
      "networkOptions": [
        {
          "adapterType": "AIOM / OCP 3.0",
          "ports": 2,
          "speedGbps": 25
        },
        {
          "adapterType": "AIOM / OCP 3.0",
          "ports": 2,
          "speedGbps": 100
        }
      ],
      "powerSupplies": {
        "redundancy": "1+1",
        "maxPsuCount": 2,
        "supportedWattages": [
          2000,
          2600
        ],
        "efficiencyRating": "Titanium",
        "inputVoltage": "AC"
      },
      "maxPowerDrawWatts": 2600,
      "cpuOptions": [
        {
          "sku": "Xeon Gold 6430",
          "architecture": "Sapphire Rapids",
          "coresPerSocket": 32,
          "threadsPerSocket": 64,
          "baseClockGhz": 2.1,
          "maxBoostClockGhz": 3.4,
          "tdpWatts": 270,
          "pcieLanesPerSocket": 80,
          "memoryChannelsPerSocket": 8
        }
      ]
    }
  ]
}